                       CPU_VGACNTRL (0x00041000): 0x80002900
                           PORT_DBG (0x00042308): 0x00000000
         DIGITAL_PORT_HOTPLUG_CNTRL (0x00044030): 0x00000000
                     FDI_PLL_BIOS_0 (0x00046000): 0x00000000
                     FDI_PLL_BIOS_1 (0x00046004): 0x00000000
                     FDI_PLL_BIOS_2 (0x00046008): 0x00000000
            DISPLAY_PORT_PLL_BIOS_0 (0x0004600c): 0x00000000
            DISPLAY_PORT_PLL_BIOS_1 (0x00046010): 0x00000000
            DISPLAY_PORT_PLL_BIOS_2 (0x00046014): 0x00000000
                   FDI_PLL_FREQ_CTL (0x00046030): 0x00000000
                   BLC_PWM_CPU_CTL2 (0x00048250): 0x00000000 (enable 0, pipe A, blinking 0, granularity 128)
                    BLC_PWM_CPU_CTL (0x00048254): 0x11561156 (cycle 4438, freq 4438)
                           HTOTAL_A (0x00060000): 0x08ab077f (1920 active, 2220 total)
                           HBLANK_A (0x00060004): 0x08ab077f (1920 start, 2220 end)
                            HSYNC_A (0x00060008): 0x081507d9 (2010 start, 2070 end)
                           VTOTAL_A (0x0006000c): 0x04710437 (1080 active, 1138 total)
                           VBLANK_A (0x00060010): 0x04710437 (1080 start, 1138 end)
                            VSYNC_A (0x00060014): 0x0446043d (1086 start, 1095 end)
                           PIPEASRC (0x0006001c): 0x077f0437 (1920, 1080)
                       VSYNCSHIFT_A (0x00060028): 0x00000000
                      PIPEA_DATA_M1 (0x00060030): 0x7e50da74 (TU 64, val 0x50da74 5298804)
                      PIPEA_DATA_N1 (0x00060034): 0x00800000 (val 0x800000 8388608)
                      PIPEA_DATA_M2 (0x00060038): 0x00000000
                      PIPEA_DATA_N2 (0x0006003c): 0x00000000
                      PIPEA_LINK_M1 (0x00060040): 0x00047dea (val 0x47dea 294378)
                      PIPEA_LINK_N1 (0x00060044): 0x00080000 (val 0x80000 524288)
                      PIPEA_LINK_M2 (0x00060048): 0x00000000
                      PIPEA_LINK_N2 (0x0006004c): 0x00000000
                        FDI_TXA_CTL (0x00060100): 0x00000000
                           HTOTAL_B (0x00061000): 0x00000000 (1 active, 1 total)
                           HBLANK_B (0x00061004): 0x00000000 (1 start, 1 end)
                            HSYNC_B (0x00061008): 0x00000000 (1 start, 1 end)
                           VTOTAL_B (0x0006100c): 0x00000000 (1 active, 1 total)
                           VBLANK_B (0x00061010): 0x00000000 (1 start, 1 end)
                            VSYNC_B (0x00061014): 0x00000000 (1 start, 1 end)
                           PIPEBSRC (0x0006101c): 0x00000000 (1, 1)
                       VSYNCSHIFT_B (0x00061028): 0x00000000
                      PIPEB_DATA_M1 (0x00061030): 0x00000000 (TU 1, val 0x0 0)
                      PIPEB_DATA_N1 (0x00061034): 0x00000000 (val 0x0 0)
                      PIPEB_DATA_M2 (0x00061038): 0x00000000
                      PIPEB_DATA_N2 (0x0006103c): 0x00000000
                      PIPEB_LINK_M1 (0x00061040): 0x00000000 (val 0x0 0)
                      PIPEB_LINK_N1 (0x00061044): 0x00000000 (val 0x0 0)
                      PIPEB_LINK_M2 (0x00061048): 0x00000000
                      PIPEB_LINK_N2 (0x0006104c): 0x00000000
                        FDI_TXB_CTL (0x00061100): 0x00000000
                           HTOTAL_C (0x00062000): 0x00000000 (1 active, 1 total)
                           HBLANK_C (0x00062004): 0x00000000 (1 start, 1 end)
                            HSYNC_C (0x00062008): 0x00000000 (1 start, 1 end)
                           VTOTAL_C (0x0006200c): 0x00000000 (1 active, 1 total)
                           VBLANK_C (0x00062010): 0x00000000 (1 start, 1 end)
                            VSYNC_C (0x00062014): 0x00000000 (1 start, 1 end)
                           PIPECSRC (0x0006201c): 0x00000000 (1, 1)
                       VSYNCSHIFT_C (0x00062028): 0x00000000
                      PIPEC_DATA_M1 (0x00062030): 0x00000000 (TU 1, val 0x0 0)
                      PIPEC_DATA_N1 (0x00062034): 0x00000000 (val 0x0 0)
                      PIPEC_DATA_M2 (0x00062038): 0x00000000
                      PIPEC_DATA_N2 (0x0006203c): 0x00000000
                      PIPEC_LINK_M1 (0x00062040): 0x00000000 (val 0x0 0)
                      PIPEC_LINK_N1 (0x00062044): 0x00000000 (val 0x0 0)
                      PIPEC_LINK_M2 (0x00062048): 0x00000000
                      PIPEC_LINK_N2 (0x0006204c): 0x00000000
                        FDI_TXC_CTL (0x00062100): 0x00000000
                          CPU_eDP_A (0x00064000): 0x00000080 (disabled not reversed x1 not detected)
                        PFA_WIN_POS (0x00068070): 0x00000000 (0, 0)
                       PFA_WIN_SIZE (0x00068074): 0x00000000 (0, 0)
                          PFA_CTL_1 (0x00068080): 0x00000000 (disable, auto_scale yes, auto_scale_cal no, v_filter enable, vadapt disable, mode least, filter_sel programmed,chroma pre-filter disable, vert3tap auto, v_inter_invert field 1)
                          PFA_CTL_2 (0x00068084): 0x00007de4
                          PFA_CTL_3 (0x00068088): 0x00003ef2
                          PFA_CTL_4 (0x00068090): 0x00007c40
                        PFB_WIN_POS (0x00068870): 0x00000000 (0, 0)
                       PFB_WIN_SIZE (0x00068874): 0x00000000 (0, 0)
                          PFB_CTL_1 (0x00068880): 0x00000000 (disable, auto_scale yes, auto_scale_cal no, v_filter enable, vadapt disable, mode least, filter_sel programmed,chroma pre-filter disable, vert3tap auto, v_inter_invert field 1)
                          PFB_CTL_2 (0x00068884): 0x00007de4
                          PFB_CTL_3 (0x00068888): 0x00003ef2
                          PFB_CTL_4 (0x00068890): 0x00007c40
                        PFC_WIN_POS (0x00069070): 0x00000000 (0, 0)
                       PFC_WIN_SIZE (0x00069074): 0x00000000 (0, 0)
                          PFC_CTL_1 (0x00069080): 0x00000000 (disable, auto_scale yes, auto_scale_cal no, v_filter enable, vadapt disable, mode least, filter_sel programmed,chroma pre-filter disable, vert3tap auto, v_inter_invert field 1)
                          PFC_CTL_2 (0x00069084): 0x00007de4
                          PFC_CTL_3 (0x00069088): 0x00003ef2
                          PFC_CTL_4 (0x00069090): 0x00007c40
                          PIPEACONF (0x00070008): 0xc0000010 (enabled, active, pf-pd, rotate 0)
                           DSPACNTR (0x00070180): 0xe0000400 (enabled)
                           DSPABASE (0x00070184): 0x00000000
                         DSPASTRIDE (0x00070188): 0x00001e00 (120)
                           DSPASURF (0x0007019c): 0x01180000
                        DSPATILEOFF (0x000701a4): 0x00000000 (0, 0)
                          PIPEBCONF (0x00071008): 0x00000000 (disabled, inactive, pf-pd, rotate 0)
                           DSPBCNTR (0x00071180): 0x00000000 (disabled)
                           DSPBBASE (0x00071184): 0x00000000
                         DSPBSTRIDE (0x00071188): 0x00000000 (0)
                           DSPBSURF (0x0007119c): 0x00000000
                        DSPBTILEOFF (0x000711a4): 0x00000000 (0, 0)
                          PIPECCONF (0x00072008): 0x00000000 (disabled, inactive, pf-pd, rotate 0)
                           DSPCCNTR (0x00072180): 0x00000000 (disabled)
                           DSPCBASE (0x00072184): 0x00000000
                         DSPCSTRIDE (0x00072188): 0x00000000 (0)
                           DSPCSURF (0x0007219c): 0x00000000
                        DSPCTILEOFF (0x000721a4): 0x00000000 (0, 0)
                         PCH_DPLL_A (0x000c6014): 0x00000000
                         PCH_DPLL_B (0x000c6018): 0x00000000
                           PCH_FPA0 (0x000c6040): 0x00000000
                           PCH_FPA1 (0x000c6044): 0x00000000
                           PCH_FPB0 (0x000c6048): 0xffffffff
                           PCH_FPB1 (0x000c604c): 0x00000000
                   PCH_DREF_CONTROL (0x000c6200): 0x00000000
                    PCH_RAWCLK_FREQ (0x000c6204): 0x0000007d
                   PCH_DPLL_TMR_CFG (0x000c6208): 0x00000000
                     PCH_SSC4_PARMS (0x000c6210): 0x00000000
                 PCH_SSC4_AUX_PARMS (0x000c6214): 0xffffffff
                PCH_DPLL_ANALOG_CTL (0x000c6300): 0x00000000
                       PCH_DPLL_SEL (0x000c7000): 0x00000000
                      PCH_PP_STATUS (0x000c7200): 0x80000008 (on, not ready, sequencing idle)
                     PCH_PP_CONTROL (0x000c7204): 0x00000007 (blacklight enabled, power down on reset, panel on)
                   PCH_PP_ON_DELAYS (0x000c7208): 0x07d00001
                  PCH_PP_OFF_DELAYS (0x000c720c): 0x01f40001
                     PCH_PP_DIVISOR (0x000c7210): 0x00186906
                   BLC_PWM_PCH_CTL1 (0x000c8250): 0xc0000000 (enable 1, override 1, inverted polarity 0)
                   BLC_PWM_PCH_CTL2 (0x000c8254): 0x11561156 (freq 4438, cycle 4438)
                     TRANS_HTOTAL_A (0x000e0000): 0x00000000 (1 active, 1 total)
                     TRANS_HBLANK_A (0x000e0004): 0x00000000 (1 start, 1 end)
                      TRANS_HSYNC_A (0x000e0008): 0x00000000 (1 start, 1 end)
                     TRANS_VTOTAL_A (0x000e000c): 0x00000000 (1 active, 1 total)
                     TRANS_VBLANK_A (0x000e0010): 0x00000000 (1 start, 1 end)
                      TRANS_VSYNC_A (0x000e0014): 0x00000000 (1 start, 1 end)
                 TRANS_VSYNCSHIFT_A (0x000e0028): 0x00000000
                     TRANSA_DATA_M1 (0x000e0030): 0x00000000
                     TRANSA_DATA_N1 (0x000e0034): 0x00000000
                     TRANSA_DATA_M2 (0x000e0038): 0x00000000
                     TRANSA_DATA_N2 (0x000e003c): 0x00000000
                  TRANSA_DP_LINK_M1 (0x000e0040): 0x00000000
                  TRANSA_DP_LINK_N1 (0x000e0044): 0x00000000
                  TRANSA_DP_LINK_M2 (0x000e0048): 0x00000000
                  TRANSA_DP_LINK_N2 (0x000e004c): 0x00000000
                     TRANS_DP_CTL_A (0x000e0300): 0x00000000
                     TRANS_HTOTAL_B (0x000e1000): 0x00000000
                     TRANS_HBLANK_B (0x000e1004): 0x00000000
                      TRANS_HSYNC_B (0x000e1008): 0x00000000
                     TRANS_VTOTAL_B (0x000e100c): 0x00000000
                     TRANS_VBLANK_B (0x000e1010): 0x00000000
                      TRANS_VSYNC_B (0x000e1014): 0x00000000
                 TRANS_VSYNCSHIFT_B (0x000e1028): 0x00000000
                     TRANSB_DATA_M1 (0x000e1030): 0x00000000
                     TRANSB_DATA_N1 (0x000e1034): 0x00000000
                     TRANSB_DATA_M2 (0x000e1038): 0x00000000
                     TRANSB_DATA_N2 (0x000e103c): 0x00000000
                  TRANSB_DP_LINK_M1 (0x000e1040): 0x00000000
                  TRANSB_DP_LINK_N1 (0x000e1044): 0x00000000
                  TRANSB_DP_LINK_M2 (0x000e1048): 0x00000000
                  TRANSB_DP_LINK_N2 (0x000e104c): 0x00000000
                           PCH_ADPA (0x000e1100): 0x00f40000
                              HDMIB (0x000e1140): 0x00000000
                              HDMIC (0x000e1150): 0x00000000
                              HDMID (0x000e1160): 0x00000000
                           PCH_LVDS (0x000e1180): 0x00000000
                     TRANS_DP_CTL_B (0x000e1300): 0x00000000
                     TRANS_HTOTAL_C (0x000e2000): 0x00000000
                     TRANS_HBLANK_C (0x000e2004): 0x00000000
                      TRANS_HSYNC_C (0x000e2008): 0x00000000
                     TRANS_VTOTAL_C (0x000e200c): 0x00000000
                     TRANS_VBLANK_C (0x000e2010): 0x00000000
                      TRANS_VSYNC_C (0x000e2014): 0x00000000
                 TRANS_VSYNCSHIFT_C (0x000e2028): 0x00000000
                     TRANSC_DATA_M1 (0x000e2030): 0x00000000
                     TRANSC_DATA_N1 (0x000e2034): 0x00000000
                     TRANSC_DATA_M2 (0x000e2038): 0x00000000
                     TRANSC_DATA_N2 (0x000e203c): 0x00000000
                  TRANSC_DP_LINK_M1 (0x000e2040): 0x00000000
                  TRANSC_DP_LINK_N1 (0x000e2044): 0x00000000
                  TRANSC_DP_LINK_M2 (0x000e2048): 0x00000000
                  TRANSC_DP_LINK_N2 (0x000e204c): 0x00000000
                     TRANS_DP_CTL_C (0x000e2300): 0x00000000
                           PCH_DP_B (0x000e4100): 0x00f40000
                           PCH_DP_C (0x000e4200): 0x00f40000
                           PCH_DP_D (0x000e4300): 0x00f40000
                         TRANSACONF (0x000f0008): 0x00000000 (disable, inactive, progressive)
                        FDI_RXA_CTL (0x000f000c): 0x00000040
                       FDI_RXA_MISC (0x000f0010): 0x0a200090 (FDI Delay 144)
                        FDI_RXA_IIR (0x000f0014): 0x00000000
                        FDI_RXA_IMR (0x000f0018): 0x00000fff
                    FDI_RXA_TUSIZE1 (0x000f0030): 0x7e000000
                    FDI_RXA_TUSIZE2 (0x000f0038): 0x7e000000
                         TRANSBCONF (0x000f1008): 0x7e000000
                        FDI_RXB_CTL (0x000f100c): 0x7e000000
                       FDI_RXB_MISC (0x000f1010): 0x7e000000
                        FDI_RXB_IIR (0x000f1014): 0x7e000000
                        FDI_RXB_IMR (0x000f1018): 0x7e000000
                    FDI_RXB_TUSIZE1 (0x000f1030): 0x7e000000
                    FDI_RXB_TUSIZE2 (0x000f1038): 0x7e000000
                         TRANSCCONF (0x000f2008): 0x7e000000
                        FDI_RXC_CTL (0x000f200c): 0x7e000000
                       FDI_RXC_MISC (0x000f2010): 0x7e000000
                    FDI_RXC_TUSIZE1 (0x000f2030): 0x7e000000
                    FDI_RXC_TUSIZE2 (0x000f2038): 0x7e000000
                      FDI_PLL_CTL_1 (0x000fe000): 0x7e000000
                      FDI_PLL_CTL_2 (0x000fe004): 0x7e000000
                      RCS_MODE_GEN7 (0x0000229c): 0x00000000
                      VCS_MODE_GEN7 (0x0001229c): 0x00000000
                      BCS_MODE_GEN7 (0x0002229c): 0x00000000
                     VECS_MODE_GEN7 (0x0001a29c): 0x00000000
                     HSW_FUSE_STRAP (0x00042014): 0x20000002
                  HSW_PWR_WELL_BIOS (0x00045400): 0x40000000
                HSW_PWR_WELL_DRIVER (0x00045404): 0xc0000000
                  HSW_PWR_WELL_KVMR (0x00045408): 0x40000000
                 HSW_PWR_WELL_DEBUG (0x0004540c): 0x40000000
                  HSW_PWR_WELL_CTL5 (0x00045410): 0x0004050f
                  HSW_PWR_WELL_CTL6 (0x00045414): 0x00000000
                          WM_PIPE_A (0x00045100): 0x00150006 (primary 21, sprite 0, pipe 6)
                      WM_LINETIME_A (0x00045270): 0x00000075
                          WM_PIPE_B (0x00045104): 0x00000000 (primary 0, sprite 0, pipe 0)
                      WM_LINETIME_B (0x00045274): 0x00000000
                          WM_PIPE_C (0x00045200): 0x00000000 (primary 0, sprite 0, pipe 0)
                      WM_LINETIME_C (0x00045278): 0x00000000
                            WM_LP_1 (0x00045108): 0x82301506 (enabled, latency 2, fbc 3, pri 21, cur 6)
                            WM_LP_2 (0x0004510c): 0x8661ad12 (enabled, latency 6, fbc 6, pri 429, cur 18)
                            WM_LP_3 (0x00045110): 0x8892d21a (enabled, latency 8, fbc 9, pri 722, cur 26)
                        WM_LP_SPR_1 (0x00045120): 0x00000000
                        WM_LP_SPR_2 (0x00045124): 0x00000000
                        WM_LP_SPR_3 (0x00045128): 0x00000000
                            WM_MISC (0x00045260): 0x00000000
                             WM_DBG (0x00045280): 0x80000000
                     AUD_TCA_CONFIG (0x00065000): 0x0070fa60
                     AUD_TCB_CONFIG (0x00065100): 0x0070fa60
                     AUD_TCC_CONFIG (0x00065200): 0x0070fa60
                   AUD_C1_MISC_CTRL (0x00065010): 0x00000044
                   AUD_C2_MISC_CTRL (0x00065110): 0x00000044
                   AUD_C3_MISC_CTRL (0x00065210): 0x00000044
                        AUD_VID_DID (0x00065020): 0x80862807
                            AUD_RID (0x00065024): 0x00100000
               AUD_TCA_M_CTS_ENABLE (0x00065028): 0x00000000
               AUD_TCB_M_CTS_ENABLE (0x00065128): 0x00000000
               AUD_TCC_M_CTS_ENABLE (0x00065228): 0x00000000
                          AUD_PWRST (0x0006504c): 0x0ffff00f
                  AUD_TCA_EDID_DATA (0x00065050): 0x00000000
                  AUD_TCB_EDID_DATA (0x00065150): 0x00000000
                  AUD_TCC_EDID_DATA (0x00065250): 0x00000000
                     AUD_TCA_INFOFR (0x00065054): 0x00000000
                     AUD_TCB_INFOFR (0x00065154): 0x00000000
                     AUD_TCC_INFOFR (0x00065254): 0x00000000
                  AUD_PIPE_CONV_CFG (0x0006507c): 0x00670007
                    AUD_C1_DIG_CNVT (0x00065080): 0x00000000
                    AUD_C2_DIG_CNVT (0x00065180): 0x00000000
                    AUD_C3_DIG_CNVT (0x00065280): 0x00000000
                    AUD_C1_STR_DESC (0x00065084): 0x00000000
                    AUD_C2_STR_DESC (0x00065184): 0x00000031
                    AUD_C3_STR_DESC (0x00065284): 0x00000031
                   AUD_OUT_CHAN_MAP (0x00065088): 0x00000000
 AUD_TCA_PIN_PIPE_CONN_ENTRY_LENGTH (0x000650a8): 0x00000403
 AUD_TCB_PIN_PIPE_CONN_ENTRY_LENGTH (0x000651a8): 0x00000003
 AUD_TCC_PIN_PIPE_CONN_ENTRY_LENGTH (0x000652a8): 0x00000003
             AUD_PIPE_CONN_SEL_CTRL (0x000650ac): 0x00030303
            AUD_TCA_DIP_ELD_CTRL_ST (0x000650b4): 0x00005400
            AUD_TCB_DIP_ELD_CTRL_ST (0x000651b4): 0x00005400
            AUD_TCC_DIP_ELD_CTRL_ST (0x000652b4): 0x00005400
                 AUD_PIN_ELD_CP_VLD (0x000650c0): 0x00000000
               AUD_HDMI_FIFO_STATUS (0x000650d4): 0x08000000
                           AUD_ICOI (0x00065f00): 0x00000000
                           AUD_IRII (0x00065f04): 0x00000000
                            AUD_ICS (0x00065f08): 0x00000000
                 AUD_CHICKENBIT_REG (0x00065f10): 0xc0000000
                  AUD_DP_DIP_STATUS (0x00065f20): 0x00004a52
                      AUD_TCA_M_CTS (0x00065f44): 0x00000000
                      AUD_TCB_M_CTS (0x00065f54): 0x00000000
                      AUD_TCC_M_CTS (0x00065f64): 0x00000000
